{
  "schema": "sister.subsystem.capabilities/1.0.0",
  "system_id": "sister_nexo",
  "contract": "sister.subsystem/1.0.0",
  "generated_at": "2026-07-31T13:30:00Z",
  "capabilities": [
    {"id": "nexo.projects.read", "description": "Ler projetos científicos autorizados.", "risk": "low"},
    {"id": "nexo.research_activities.manage", "description": "Gerenciar atividades de pesquisa.", "risk": "high"},
    {"id": "nexo.evidence.review", "description": "Revisar evidências científicas.", "risk": "high"}
  ]
}
